"2018 Blytheville ProSolo Results for SSC",/blog/2018-Blytheville-ProSolo-Results-for-SSC,"<p><a title=""SSC Cars in Impound waiting for the Challenges"" href=""https://www.flickr.com/photos/chammond/26990079767/in/album-72157690612809440/"" data-footer=""true"" data-header=""true"" data-flickr-embed=""true""><img width=""500"" height=""333"" alt=""SSC Cars in Impound waiting for the Challenges"" src=""https://farm1.staticflickr.com/906/26990079767_9da6e5a1e9.jpg""></a><script async src=""//embedr.flickr.com/assets/client-code.js"" charset=""utf-8""></script></p>
<p>In short, WOW. What an amazing weekend. </p>
<p>I went into the weekend hopeful that I would drive the car well, and that I would be able to prove to myself that I can hang with the big dogs. I’ve been autocrossing for a long time (with a few gaps in between) and while I’ve had some spurts of random success outside of St. Louis, I have never felt confident that I could do it repeatedly. The idea of SSC, a Spec class in Solo, was very intriguing to me, as I wanted to try to rule out “I don’t have the right car”, from the equation.</p>
<p>The weekend started out with me leaving St. Louis just after 1pm due to a company all hands meeting. I ended up getting down to Arkansas Aeroplex in Blytheville just after 5pm on Friday evening. I parked the car and met up with my co-driver for the weekend, Kevin Dietz out of Washington state. We discussed if there was a chance to do practice starts, or take a shot at the practice course. The practice starts were wrapping up, so I quickly unloaded the car and headed over. We ended up taking 7 practice runs between the two of us, and found the car to be rather pushy. </p>
<p>At this point we debated what to do to try to correct for the pushiness. Kevin thought that we needed to try to fix it with alignment as we had already taken out all the front shock (set them at full soft). In my packing haste on Thursday evening I realized I forgot to pack my toe plates and camber gauge. Matt Hodges had set however, so we were covered there if we did decide to change the alignment. After much debate we decided that we wouldn’t change anything until after morning runs on Saturday. We went through tech, at which point I said hello to the other driver of the car for the weekend, Lori Gill out of Topeka Kansas. </p>
<p>We got a few course walks in before sunset and then I headed off to Wal-Mart for the supplies I needed for a weekend of autocross, sunscreen, sandwich meats, drinks, ice and even a new cooler. Saturday morning started out with breakfast at the Perkins attached to the Holiday Inn, which took WAY too darn log for a serving of biscuits and gravy, I then headed to the event site and got a few course walks in on each side.&nbsp; From there it was time to finish the final prep on the car, which included getting a few more of the required decals mounted. </p>
<p>Lori was the first driver up for the weekend, competing in L4, so I took the car over to grid to get her setup and ready for the 9am start time. Lori headed out and ran in L4 having a good showing for her first time in the car. When SSC was up in Group 3, I went out as first driver and had a red light on my left side runs. On the right side course I ended up with a cone on each run. That put myself in I believe 12th place out of 13 for the class. Even with that poor placement, I was pretty happy. I had fun driving the car, and without the cones and red lights, I was sure that I could hold my own in the car in the class if I cleaned things up.</p>
<p>Kevin went out with the second driver pairings, and performed very well. He ended up sitting in the lead in SSC after the Saturday morning runs, and didn’t let that lead go all weekend. After the morning runs, and the performance of the car we decided that we didn’t need to make changes to the alignment and would run it as is.</p>
<p>Being the leader, Kevin was now gridded at the front of the class, and went out on his Saturday afternoon runs and improved on his times on both sides by .171. Me, being near the bottom of the pack got relegated to the second driver line, we decided to try setting the front shocks back up a little bit, so I turned them from full soft, 1/2 turn. I went out and on my first Saturday afternoon left side run and turned my two prior red lights into a coned run, but at least it was a time. On the right side I was able to clean up cones from the first two passes, and on my final run on the right side run make up more time. I managed to move up into 3rd spot, .056 back from David Lousteau, and .256 back from Kevin. Funny story, after my second left side run, I immediately headed to impound, I was stoked that I finally had a good run on the left and completely forgot that I needed to run one more run on the right. Lucky for me I was able to get back in line and get the right side run completed.</p>
<p>Sunday morning Kevin and I both went out with the goal of improving things considerable. I was honestly hoping to catch him, and he was hoping to put down quick runs on his first runs to try and increase his lead on the class. He succeeded, I did not. Kevin managed to put his fastest times down for the weekend on his final run on each side. I managed to do my fastest on Sunday morning as well, but not near as fast as I think I could have been. Ultimately I finished in third place, a trophy spot, and Kevin took the win in the SSC class.</p>
<p>Towards the end of the day I was sitting in 44th qualifying position for the Super Challenge, the 32 car bracket competition at the end of the ProSolo event. I put my name into the drawing to get into the 8 car bonus challenge, but with all of the people who ended up dropping out of the Super Challenge bracket I ended up getting in as the 32nd seed. Kevin got in as the 6th seed I believe.</p><h2>Super Challenge</h2> <a data-flickr-embed=""true"" data-header=""true"" data-footer=""true""  href=""https://www.flickr.com/photos/chammond/40959600555/in/album-72157690612809440/"" title=""Spec FR-S leaving the Line""><img src=""https://farm1.staticflickr.com/910/40959600555_7ac6e2412b.jpg"" width=""500"" height=""333"" alt=""Spec FR-S leaving the Line""></a><script async src=""//embedr.flickr.com/assets/client-code.js"" charset=""utf-8""></script> <p>With the bracket competition, each car lines up and runs their Class’ dial in time, which for me, meant in order to be fast, I needed to run Kevin’s fastest time for the right side, and left side. To account for this, each car that lines up in the bracket has a unique pattern to the lights at the starting line. For a slower car, such as SSC, that means we would typically leave BEFORE the car we are lined up against, with the idea being that if we both ran perfect times we would cross the finish line at exactly the same time. My first time in the Super Challenge was not uneventful. I went out on the right side course, lined up against the #1 see, David Whitner. The right side course was slightly slower all weekend compared to the left side course, so when I came back, with an 8/10ths of a second difference from David I was pretty happy, knowing that I could probably make up that difference on the left side.</p>
<p>When David and I lined up on the 2nd runs, I was on the left. The “christmas tree”, the drag strip lights that tell us when to start, started coming down, but they came down first for David, and not for me as they should. I immediately thought something was wrong, but I couldn’t risk sitting there and not taking a run, so I left when my lights eventually dropped. That run on the left side was sloppy, I was not happy with it, but I was pretty stoked when I came in from the run and was told to get right back in the lane for the left side and to take another run. They had entered the dial in times incorrectly, so they needed us to run the course again. On my second time around the left course, the car felt MUCH better. Problem is, I picked up a cone early on in the process. I still pushed to get the car back across the finish with a decent time, but I couldn’t make up the deficit of the cone and I was bumped from my first Super Challenge attempt in the first round.</p>
<p>Kevin ended up in the 2nd to last pairing out of the round of 32, lined up and defeated Chris Edens in an S2 Miata. The next round Kevin lined up against Russell Blume in his HS Mini Cooper and took him down as well. The third round was SSC #1 and #2 with David Lousteau lining up against Kevin. Again Kevin drove away victorious to line up against Mike King out of Florida, in his HS Ford. The final round had Kevin lined up against Jonathan Warlof in a blue Mustang. I can’t do justice with words the excitement I had of that final round, so I would encourage you to <a href=""https://www.facebook.com/christopherhammond/videos/10156457657654703/"" target=""_blank"">watch the video from my Facebook Live session</a>.</p>
<p><br></p>  <p><iframe width=""267"" height=""476"" src=""https://www.facebook.com/plugins/video.php?href=https%3A%2F%2Fwww.facebook.com%2Fchristopherhammond%2Fvideos%2F10156457657654703%2F&amp;show_text=0&amp;width=267"" frameborder=""0"" scrolling=""no"" allowfullscreen=""true"" style=""border: currentcolor; border-image: none; overflow: hidden;"" allowtransparency=""true""></iframe></p>
<p>Here’s the video from on top of the car of Kevin’s Super Challenge win.</p>
<p><iframe width=""560"" height=""315"" src=""https://www.youtube.com/embed/H97rPchYJ4E"" frameborder=""0"" allow=""autoplay; encrypted-media"" allowfullscreen></iframe></p><h2>Autocross Settings:</h2><p><strong>Front Swaybar: </strong>Soft setting<br><strong>Rear Swaybar:</strong> Stiff Setting<br><strong>Front Konis:</strong> 0.5 turn from soft<br><strong>Rear Konis:</strong> 1.5 turns from soft<br><strong>Front Tire Pressure:</strong> 32 psi<br><strong>Rear Tire Pressure:</strong> 32 psi <p> <a data-flickr-embed=""true"" data-header=""true"" data-footer=""true""  href=""https://www.flickr.com/photos/chammond/26990122027/in/album-72157690612809440/"" title=""Challenge Winners""><img src=""https://farm1.staticflickr.com/869/26990122027_c44c9d1814.jpg"" width=""500"" height=""333"" alt=""Challenge Winners""></a><script async src=""//embedr.flickr.com/assets/client-code.js"" charset=""utf-8""></script> </p>",2018-05-03 01:52:44,html,,"[ Autocross, Toyota, Scion, FR-S, SSC, Setup  ]
"SSC Contingency Opportunities",/blog/SSC-Contingency-Opportunities,"<p>So one of the ways to help supplement the cost of autocross at a National level with the SCCA is to participate in their contingency programs. There are a variety of contingency options available, depending on:</p><ul><li>What make of car you drive</li><li>What class you run in</li><li>What tires you run</li><li>What programs you register for</li></ul><p>You should check out the <a href=""https://www.scca.com/pages/solo-contingency"" target=""_blank"">SCCA Autocross Contingency page</a> to see which options are available to you, and which will work for your particular class/car.</p>
<p>What’s the catch with contingencies? Well, you typically (almost always) have to run your vehicle with the sponsors decals on the vehicle. </p> <a data-flickr-embed=""true"" data-header=""true"" data-footer=""true""  href=""https://www.flickr.com/photos/chammond/39900291410/in/dateposted/"" title=""Spec FR-S Decked Out""><img src=""https://farm1.staticflickr.com/964/39900291410_b5302163bd.jpg"" width=""500"" height=""375"" alt=""Spec FR-S Decked Out""></a><script async src=""//embedr.flickr.com/assets/client-code.js"" charset=""utf-8""></script> <p>For SSC, here are the contingencies that I believe to be applicable.</p><ul><li>TRD – ProSolo</li><li>Falken Tire – ProSolo &amp; Champ/Match Tours</li><li>Hawk Performance Brakes - ProSolo &amp; Champ/Match Tours</li><li><a href=""http://www.soloperformance.com/"" target=""_blank"">Solo Performance Specialties</a> – Champ/Match Tours</li><li>RaceChick.com – ProSolo (ladies)</li></ul><p>The amounts will all vary, but Falken for example will pay $300 for first, $200 for second and $100 for third. </p>",2018-04-26 02:58:53,html,,"[ Autocross, Toyota, Scion, FR-S, SSC  ]
"First event in SSC",/blog/First-event-in-SSC,"<p align=""left"">Today was the first St. Louis Region Solo event in the 2018 series, so it was the first time out in the car, and I must say, it was great (albeit cold, windy, and even snowing/sleeting/raining at times)! <a href=""https://www.youtube.com/watch?v=SGoV08aTlmU"" target=""_blank"">Natalie</a> got to take the first runs in the car, actually the first 6! She hasn&rsquo;t seriously autocrossed since 2008 when we had the <a href=""http://www.corvettez06.org/"" target=""_blank"">Corvette</a>, but I believe this year will be different and she&rsquo;ll run quite a few local events and then we&rsquo;ll see if I can&rsquo;t talk her into Solo Nationals as well. Natalie managed to get down to a 51.997 on her 4th run, but trying harder on run 5 and 6 she went the other direction on the clock. We&rsquo;ll see where she placed within the ladies challenge once the results are published later this week.</p>  <p align=""left""><a data-flickr-embed=""true"" data-footer=""true"" data-header=""true"" href=""https://www.flickr.com/photos/chammond/41484915701/in/dateposted/"" title=""Couples Autocross""><img alt=""Couples Autocross"" height=""375"" src=""https://farm1.staticflickr.com/819/41484915701_c0dbb0aa1c.jpg"" width=""500"" /></a><script async src=""//embedr.flickr.com/assets/client-code.js"" charset=""utf-8""></script></p>  <p align=""left"">My turn to run was the third heat, which surprising started just around 1pm or maybe a little after. (The STL region really had their stuff organized for event #1, definitely ran smoothly considering it was the first event of the year). There were 3 other drivers in SSC today in St. Louis, Michael Kopec and a gentlemen from Troy, IL who was out in his car at his first autocross! That takes some commitment, getting into autocross in a spec class right off the bat, hope to see him at more local events this year.</p>  <p align=""left"">My first run I went out an ran a 47.477, though I plowed through 3 cones after the finish (might as well get my own cone cherry popped on my first run in the car).</p>  <p align=""left"">My second run I went a just under a tenth of a second faster, but picked up a cone on the front portion of the course. My 3rd 4th and 5th runs ended up getting faster, each separated by a couple of hundredths. I was ultimately able to get my fastest clean time down to 46.497, .832 ahead of Kopec for the day.</p>  <p align=""left"">Here&rsquo;s a video from my fastest run.</p>  <p><iframe allow=""autoplay; encrypted-media"" allowfullscreen="""" frameborder=""0"" height=""315"" src=""https://www.youtube.com/embed/HtN1BvhQrfI"" width=""560""></iframe></p>  <p>Settings:</p>  <p>Front Swaybar: Soft setting</p>  <p>Rear Swaybar: Stiff Setting</p>  <p>Front Konis: 1 turn from soft</p>  <p>Rear Konis: 1.5 turns from soft</p>  <p>Front Tire Pressure: 35 psi</p>  <p>Rear Tire Pressure: 34 psi</p>  <p>&nbsp;</p>  <p>On my 6th run the course was started to get slick due to the rain/sleet, and I ended up losing control on the back half of the course. On the way home the car felt funky, so I stopped and took the turns out of the Konis. I ended up noticing that the steering wheel was off center, and then I noticed that both the ABS and SLIP lights were on the dash. I scanned the OBD2 with my Torque app to see if there were any codes being thrown for those two lights, but wasn&rsquo;t able to find anything. My internet research, and help from the SSC group on Facebook leads me to believe that the alignment (wheel being crooked) is what is causing the lights. I&rsquo;ll head over to SPS this week and see what I screwed up when I spun today!</p>  <p>Overall I&rsquo;m stoked about how much fun I had in the car today. I didn&rsquo;t win PAX, but I didn&rsquo;t expect to, the PAX for this class doesn&rsquo;t appear to be close to a valid equalizer for 2018. I will be surprised if I get in the top 2 on PAX at all this year locally, but we&rsquo;ll see, maybe I&rsquo;ll be surprised.&nbsp; I&rsquo;m looking forward to the Misfit Toys event next weekend, and the Blytheville ProSolo the following weekend!</p>  <p>&nbsp;</p> ",2018-04-16 02:14:13,html,,"[ Autocross, Scion, FR-S, SSC, Setup  ]
"Autocross alignment in St. Louis Missouri",/blog/Autocross-alignment-in-St-Louis-Missouri,"<p>With the parts installed on the car, it was time to get wheels and tires mounted/balanced and installed. I also needed to get an alignment on the car as I knew it wasn’t close to the autocross specs that Tire Rack had in their recommendations. So I took my car to the only place I trust for an <a href=""http://www.soloperformance.com/alignment"" target=""_blank"">autocross alignment</a> in Missouri, <a href=""http://www.soloperformance.com/"" target=""_blank"">Solo Performance Specialties</a>.</p>
<p>The tires mounted up nice and easy on the Konig Ampliforms, after I got the wheels with the <a href=""http://specfrs.com/Blog/aid/6"" target=""_blank"">right bolt pattern of course</a>. They were mounted onto the car and it was up on to the alignment rack next. </p>
<p><a data-flickr-embed=""true"" data-header=""true"" data-footer=""true""  href=""https://www.flickr.com/photos/chammond/39569348460/in/photostream/"" title=""SpecFRS.com""><img src=""https://farm1.staticflickr.com/889/39569348460_4f34229364_z.jpg"" width=""640"" height=""480"" alt=""SpecFRS.com""></a><script async src=""//embedr.flickr.com/assets/client-code.js"" charset=""utf-8""></script></p>
<p>Dave at Solo Performance knows his stuff, so he was able to get the car setup as recommended.</p>
<p>Alignment Specs</p>
<p>Front Camber: -3 degrees<br>Front Caster: 5.4 degrees<br>Front Toe: 0 inches</p>
<p>Rear Camber: –2.25 degrees<br>Rear Toe: 1/8” toe in </p>
<p><a data-flickr-embed=""true"" data-header=""true"" data-footer=""true""  href=""https://www.flickr.com/photos/chammond/27530585808/in/photostream/"" title=""SpecFRS.com Alignment""><img src=""https://farm1.staticflickr.com/792/27530585808_1fe8647719_z.jpg"" width=""640"" height=""480"" alt=""SpecFRS.com Alignment""></a><script async src=""//embedr.flickr.com/assets/client-code.js"" charset=""utf-8""></script></p>
<p>Next up is the first St. Louis region autocross on April 15th. There are 3 SSC cars entered, so let’s see how this thing (and mainly this driver) does! </p>",2018-04-13 03:51:32,html,,"[ Autocross, Scion, FR-S, SSC, Install, Setup  ]
"FR-S Bolt Pattern 5x100",/blog/FRS-Bolt-Pattern-5x100,"<p>Somehow a week ago when I ordered wheels for the FR-s I got it in my head that the bolt pattern was 5x114.3, but somehow I got it wrong (they should be 5x100)! </p>
<p>Earlier this week I went to <a href=""http://www.soloperformance.com/"" target=""_blank"">SoloPerformance</a> to mount my Falken Azenis RT615k+s to my newly purchased Konig Ampliforms (courtesy of <a href=""http://www.motorsportsammo.com"" target=""_blank"">MotorsportsAmmo.com</a>), I got one of the wheels ready on the tire machine and was about to mount one of the Falkens when Dave and I remembered we needed to deal with TPMS. Due to some new sensors that he purchased and an incompatibility with the FR-S, we spent an hour trying to upgrade the scanner’s firmware to make the TPMS devices work for the Scion FR-S. While researching if I could run without TPMS, I came across a post that mentioned a 5x100 bolt pattern wheel. At this point I freaked out and started researching if I in fact ordered the wrong bolt pattern for my 2016 Scion FR-S. I, in fact, did. </p>
<p>I emailed <a href=""http://www.MotorsportsAmmo.com"" target=""_blank"">MotorsportsAmmo.com</a> to see if there was a chance that I could return the wheels and try to get the proper bolt pattern. They were great, they quickly got me an RMA, and Dave at SPS shipped them back for me. I should have the new, proper bolt pattern, 5x100, in hand on Monday and hopefully will be able to get them mounted and an alignment done next week before my first local autocross in SSC, August 15th in St. Charles MO, <a href=""http://www.stlsolo.org"">www.stlsolo.org</a>.</p>",2018-04-07 03:10:51,html,,"[ Autocross, Toyota, Scion, FR-S, SSC, Install, Setup  ]
"Solo Spec Coupe Parts Installation",/blog/Solo-Spec-Coupe-Parts-Installation,"<p>After a long couple of days working on the FR-S, interspersed with family events and other activities, I finally have the suspension components installed on the FR-S.</p>  <p><iframe allow=""autoplay; encrypted-media"" allowfullscreen="""" frameborder=""0"" height=""315"" src=""https://www.youtube.com/embed/2HGBNpxXpxs"" width=""560""></iframe></p>  <p>&nbsp;</p>  <p>If you&rsquo;re interested in doing the installation yourself, be sure to check out the <a href=""https://www.tirerack.com/tires/tiretech/techpage.jsp?techid=338"" target=""_blank"">TireRack write-up</a>. I am not going to recreate the write-up, it covers a lot of what you need to know, I am going to cover some of the items that I feel the write-up misses.</p>  <p>First things first, don&rsquo;t try to just go based off of the TR write-up, you should also read any of the instructions that come with the parts you ordered. I made the mistake of trying to just use the write-up and got burned on a few items, had I just read all of the instructions first I would of saved myself some headache.</p>  <blockquote> <ul>  <li>Two plastic fasteners for lower plastic panel covering sway bar mount. Swing panel out of way.</li>  <li>Three upper strut nuts (12).</li>  <li>One bolt towards the front for the sway bar mount (14).</li>  <li>One nut underneath towards the rear for the sway bar mount (12). This can be accessed from below through a hole in the frame member by removing the two bolts (10) holding that side of the flexible cover.*</li>  <li>Remove sway bar from passenger side with shock assemblies out on both sides. Twist ends to the rear.</li> </ul>  <p><strong>Note*:</strong> If the cover does not give enough access, then the metal shield with four cover bolts (10), six shield bolts (12), and six plastic fasteners may have to be removed. One each of the three plastic fasteners on each side is underneath the fender liner towards the front.</p> </blockquote>  <p>This is where I diverged from the instructions, getting to the sway bar mounts, I have no idea how anyone could remove the sway bar without removing the subframe connectors. I ended up taking both the metal tray under the engine, and the composite tray over the exhaust/transmission from the car in order to remove the subframe connectors which then drops the sway bar out of the car. Also in the Notes, there are 7 plastic fasteners on my car, one in the middle, that holds the metal tray.</p>  <p>Next up was removal of the upper mount bearing from the stock strut. I ended up removing this without using a spring compressor, though I wouldn&rsquo;t recommend it. I have a bruise on my wrist from the mount popping off when the nut came free, definitely learned a lesson on this one! I did end up using the spring&nbsp;compressors to install the Eibach springs on the Konis up front.</p>  <p>When assembling the front Struts, and the rears, be sure to figure out your dust boot situation. The Eibach springs, come with 2 new dust boots, I ended up putting these on the front struts, though other people have said they installed them on the Rear and reused the OEM fronts on the Koni fronts. I ended up using the OEM rear boots on the rear with the Konis and Eibachs.</p>  <ul>  <li>Install new lower SPC camber bolt (15) with nut (17) to the front. Tab on SPC bolt horizontal to the outside for approximate maximum camber.</li> </ul>  <p>The next point of clarification is related to the bolts used on the bottom of the front struts, there are two. When installing the new struts, use the SPC camber bolt on the bottom hole, and use the original bottom bolt (oem) in the upper hole. You can tell the difference between the two bolts by looking at the shafts. The original TOP bolt is thicker on one side, the bottom one is uniform and will give you more adjustment for camber by installing it at the top position. I saved the original top bolt with all the rest of the OEM parts.</p>  <p>How do you mount the SPC bolt? <a href=""http://www.spcalignment.com/instructions/81305-INS_WEB.pdf"" target=""_blank"">Read the instructions here</a>.</p>  <p>Moving on to the Rear of the car, you&rsquo;ll come across this in the instructions</p>  <ul>  <li>Three upper shock nuts (12).</li> </ul>  <p>That line is incorrect, it should be Two upper shock nuts, and I think they are 14s, not 12s.</p>  <p>Putting the rear shocks together, I ended up using the spring compressor to remove the OEM upper mount, but assembling the Konis I ended up compressing it by hand. I was able to press down on the shock mount enough to thread the nut onto the shaft of the Konis and run the nut down by hand with a socket. This is a much easier job if you have a second person to assist, one to compress and one to turn the nut down.</p>  <p>&nbsp;</p>  <p>&nbsp;</p>  <p><a data-flickr-embed=""true"" data-footer=""true"" data-header=""true"" href=""https://www.flickr.com/photos/chammond/41176740751/in/album-72157694192449114/"" title=""Install Completed""><img alt=""Install Completed"" height=""375"" src=""https://farm1.staticflickr.com/787/41176740751_44eec849c8.jpg"" style=""margin-right: auto; margin-left: auto; float: none; display: block;"" width=""500"" /></a><script async src=""//embedr.flickr.com/assets/client-code.js"" charset=""utf-8""></script></p>   <ul> <li><a href=""http://www.billswebspace.com/PTR07-18130inst.pdf"" target=""_blank"">TRD Lowering Springs install guide</a></li> </ul>",2018-04-02 06:26:11,html,,"[ Autocross, Toyota, FR-S, SSC, Install, Setup  ]
"New ride for 2018, my 2016 Scion FR-S",/blog/New-ride-for-2018-my-2016-Scion-FRS,"<p>I have been scouring the interwebs for a good month or so looking for the perfect FR-S for my SSC build, and came across the one via Autotrader. I reached out to the dealership via Autotrader, and also via TrueCar.com to see what kind of deal I could get on the car. The asking price was $18499, via the TrueCar inquiry they immediately dropped $125 from the price, though the TrueCar quote was adjusted to include a $598 dealer documentation fee, for a total price of $18,972.</p>  <a title=""2016 Scion FR-S"" href=""https://www.flickr.com/photos/chammond/40148396415/in/dateposted/"" data-footer=""true"" data-header=""true"" data-flickr-embed=""true""><img width=""500"" height=""375"" alt=""2016 Scion FR-S"" src=""https://farm1.staticflickr.com/814/40148396415_541a6a97c2.jpg"" align=""center""></a><script async src=""//embedr.flickr.com/assets/client-code.js"" charset=""utf-8""></script>  <p>I managed to talk the dealer down about $1k from that price, and after Brian Johns from <a title=""https://carpartment.wordpress.com/"" href=""https://carpartment.wordpress.com/"">https://carpartment.wordpress.com/</a> stopped by the dealer to check it out for me, I placed a deposit via the phone on Friday night the 9th. Just over a week and a half ago I hitched a ride with Dave from <a href=""http://www.SoloPerformance.com"">SoloPerformance.com</a> down to the Dixie Champ Tour in Adel, Georgia. On the way down we stopped in Murfreesboro, Tennessee at Toyota of Murfreesboro to pick up my new SSC ride, a 2016 Scion FR-S.</p>
<p>Because we were on our way down to the Champ Tour, and we wanted to try to swing by the Jack Daniel’s Distillery, we were sort of in a rush when we arrived at the dealer with the truck and trailer in tow. I was hoping to get and our of the dealership in under 2 hours, which, unfortunately, is impossible with car dealers. I performed a quick test drive of the car, and looked her over to see what condition it was in. Overall I was disappointed as I had been told that the car would be detailed before I arrived, but it was far from detailed. It had a rough surface, some sort of film/overspray over most of the car, (top, windows, hood) that was very rough to the touch. It wasn’t bad enough that I would change my mind on the car, I figured I would just detail it myself when I had the time and get it cleaned up.</p>
<p>After that, we tried to move forward with the paperwork, I had pre-approval paperwork ready to go from my bank, and even with that it took about 2.5 hours after we arrived before I was back on the road trying to catch up with Dave and his dad who headed off to Lynchburg to take a tour of the distillery. </p>
<p>Stay tuned for more posts here on the <a href=""http://www.specfrs.com"">SpecFRS blog</a>, and be sure to <a href=""https://twitter.com/specfrs"">follow us on Twitter too</a>.</p>
<p><br></p>",2018-03-27 03:32:58,html,,"[ Toyota, Scion, FR-S  ]
"What is SSC? Solo Spec Coupe",/blog/What-is-SSC-Solo-Spec-Coupe,"<p>Solo Spec Coupe. SSC. The next big thing in SCCA Autocross.</p>  <p>What is SSC? In September 2017, the Sports Car Club of America announced the creation of a new breed of autocross competition, a Spec class. Why does SCCA need a Spec class in Autocross? I say why not! Who doesn&rsquo;t want to take &ldquo;car selection&rdquo; out of the mix in autocross? If you can successfully do that, you open up the idea of a true driver&rsquo;s class, a real skill competition pitting driver against driver.</p>  <h2>What cars are part of SSC?</h2>  <p>For now the class is built around the 2013-2016 Scion FR-S and Subaru BRZ, otherwise known as the Twins. These two cars were built in in a partnership with Toyota and Subaru. They share a platform, similar looks, and the same 2.0 liter Subaru boxer engine. The cars are equipped similarly, with the Subaru having slightly more &ldquo;up-scale&rdquo; refinements.</p>  <h2>What modifications are legal in SSC?</h2>  <p>The SPEC portion of the class means you can run only the specific parts, and anything outside of these are not legal in the class. The published parts here are from the <a href=""https://www.scca.com/ssc"">SCCA&rsquo;s SSC page.</a></p>  <ul>  <li>Koni&reg; Sport (Yellow) struts/shocks w/ tamper-proof seal</li>  <li>Eibach&reg; PRO-PLUS Performance Handling Package (springs and adjustable anti-roll bars)</li>  <li>SPC Performance&reg; Adjustable Alignment Kit (camber bolts, adjustable lower control arms, and toe arms)</li>  <li>Tires: Falken Azenis RT615K+ (225/45R17).</li>  <li>Wheels: 17&quot;x8&quot;, 17 pounds minimum, wheel offset +40 (40ET) or greater.</li> </ul>  <p>In addition to the publish parts, you can also read all of the Class Rules. Unlike most other classes in SCCA Autocross, this class doesn&rsquo;t &ldquo;build&rdquo; on anything other than the ruleset here. You can&rsquo;t take an STX build and add these parts to make it an SSC car, you need to remove any modifications not listed in the rules in order to be legal for the class.</p>  <p>Spec in this case also means the tires. The Falken Azenis RT615K+ (size 225/45R17) is the required tire for the class, any other tire, more performant, or less performant, would be outside of the rules of the class.</p>  <h2>Which car is the best to have for the SSC class?</h2>  <p>The whole idea of the class is that there isn&rsquo;t one car that is best, ideally any choice of FR-S or BRZ, and any year, should ideally work. Will it play out that way? We will see. The class is brand new, there has been one SCCA National event so far this year. The Dixie Champ Tour is coming up, and currently has 11 cars registered, so we will see what happens as the year progresses.</p>  <p>One thing to keep in mind in terms of car selection is Contingency money. Toyota has stepped up to offer a contingency for SSC at ProSolo events with $200 for the class win, and $1,000 for a year end class win, plus an additional $1,000 for a year end challenge win. I don&rsquo;t believe Subaru has any contingency program available for 2018 at least at this point in time (March 2018).</p>  <h2>Is the class a Supplemental class?</h2>  <p>This is a common question, and the reason it is asked is because the supplemental tag in National autocross means that the class doesn&rsquo;t qualify for a National Championship. Typically supplemental classes are trials, new classes, that need some testing to see if they will work out.&nbsp; This is exactly what SSC is right now, supplemental, a test. That being said, in the Town Hall event that the SCCA held at the end of February 2018, the question was asked if it will continue to be a supplemental class. The response was, yes, it currently is, but there&rsquo;s a chance that will change. So there is hope that SSC will qualify for a National Championship in 2018.</p> ",2018-03-08 03:46:20,html,,"[ Autocross, Toyota, Scion, FR-S, Subaru, BRZ, SSC  ]
